id,article,txt
2.2.6.2.62,62,"Article 62 1. The Agency shall exercise its right of option as to special fissionable materials produced in the territories of Member States in order: (a) to meet the demands of users within the Community in accordance with the provisions laid down in Article 60; (b) itself to stock such materials; or (c) to export such materials subject to the authorisation of the Commission which shall comply with the provisions of Article 59, paragraph (b), second sub-paragraph. 2. Nevertheless, while continuing to be subject to the provisions of Chapter VII, these materials and their fertile residues shall be left in the possession of the producer, in order that the latter may: (a) stock them with the authorisation of the Agency; (b) use them within the limits of his own requirements; or (c) make them available, within the limits of their requirements, to enterprises within the Community which have direct ties with him, for the purpose of carrying out a programme duly communicated to the Commission; provided that such ties do not, in intention or in fact, restrict production, technical development or investment or improperly create inequalities between users within the Community. 3. The provisions of Article 89, paragraph 1, (a), shall apply to any special fissionable materials in respect of which the Agency has not exercised its right of option and which are produced in the territories of Member States."
2.2.6.2.63,63,"Article 63 Any ores, source materials or special fissionable materials produced by Joint Enterprises shall be allotted to users in accordance with the statutory or conventional rules governing such Enterprises."
2.2.6.3.64,64,"Article 64 The Agency, acting, as the case may be, within the framework of any agreements entered into between the Community and a third country or an international organisation, shall, subject to the exceptions provided for in this Treaty, have the exclusive right to conclude agreements or conventions having as their principal object the supply of ores, source materials or special fissionable materials coming from outside the Community."
2.2.6.3.65,65,"Article 65 The provisions of Article 60 shall apply to demands from users and to contracts entered into between users and the Agency concerning the supply of ores, source materials or special fissionable materials coming from outside the Community. The Agency may, however, decide as to the geographical origin of the supplies provided that in doing so it ensures for the user conditions at least as favourable as those specified in his order."
2.2.6.3.66,66,"Article 66 Where the Commission finds, at a request from the users concerned, that the Agency is unable, within a reasonable period, to fulfil either in whole or in part an order for supplies or is able to fulfil it only at an excessive price, users shall have the right to conclude direct contracts for supplies coming from outside the Community, provided that such contracts correspond substantially to their requirements as specified in their order. Such right shall be granted for a period of one year and shall be renewable where the situation originally justifying the grant of such right continues to exist. Users availing themselves of the right provided for in this Article shall communicate to the Commission any proposed direct contracts. The Commission may, within a period of one month, oppose the conclusion of such contracts if they are contrary to the aims of this Treaty."
2.2.6.4.67,67,"Article 67 Subject to the exceptions provided for in this Treaty, prices shall result from the comparison of offer and demand, in accordance with the provisions laid down in Article 60; Member States may not, by means of domestic provisions, contravene these provisions."
2.2.6.4.68,68,"Article 68 All price manipulations designed to ensure a privileged position for certain users, which are contrary to the principle of equal access resulting from the provisions of this Chapter, shall be forbidden. If the Agency finds that any such practices exist, it shall report them to the Commission. If the Commission considers that the Agency’s findings are well founded, it may, in the case of disputed offers, restore the prices to a level compatible with the principle of equal access."
2.2.6.4.69,69,"Article 69 The Council may fix prices acting by means of a unanimous vote on a proposal of the Commission. Where the Agency, in applying the provisions of Article 60, determines the conditions on which orders may be fulfilled, it may propose price adjustments to any users who have placed orders with it."
2.2.6.5.70,70,"Article 70 The Commission may, within the limits set out in the budget of the Community, contribute financially, on conditions laid down by itself, to any prospecting activities in the territories of Member States. The Commission may make recommendations to Member States with a view to the development of prospecting for and the exploitation of mineral deposits. Member States shall submit annually to the Commission a report on the development of prospecting and production, on probable reserves and on mining investment effected or proposed in their territories. Such reports shall be submitted to the Council together with the opinion of the Commission, which shall in particular concern the action taken by Member States on the recommendations made to them in accordance with the preceding paragraph. Where, on such reference to it by the Commission, the Council by means of a qualified majority vote finds that, in spite of extraction possibilities appearing economically justifiable on a long-term basis, the measures taken for prospecting and the increase in the exploitation of mineral deposits continue to be substantially inadequate, the Member State concerned shall, for as long as it has not corrected this state of affairs, be deemed to have relinquished, both for itself and for its nationals, the right of equal access to other such resources within the Community."
2.2.6.5.71,71,Article 71 The Commission shall make any appropriate recommendations to Member States in regard to fiscal or mining provisions.
2.2.6.5.72,72,"Article 72 The Agency may, from the quantities available inside or outside the Community, build up the commercial stocks necessary to facilitate the Community’s supplies or current deliveries. The Commission may decide to build up emergency stocks. The terms of financing such stockpiling shall require the approval of the Council acting by means of a qualified majority vote on a proposal of the Commission."
2.2.6.6.73,73,"Article 73 Where an agreement or a convention between a Member State, a person or enterprise, of the one part, and a third country, an international organisation or a national of a third country, of the other part, also contains any provisions relating to the delivery of products coming within the competence of the Agency, the prior consent of the Commission shall be required for the conclusion or renewal of such agreement or convention, to the extent that the delivery of such products is concerned."
2.2.6.6.74,74,"Article 74 The Commission may exempt from the application of the provisions of this Chapter the transfer, importation or exportation of such small quantities of ores, source materials or special fissionable materials as are commonly used for purposes of research. Any transfer, importation or exportation effected pursuant to this provision shall be notified to the Agency."
2.2.6.6.75,75,"Article 75 The provisions of this Chapter shall not apply to undertakings in respect of the processing, transformation or shaping of ores, source materials or special fissionable materials entered into between: (a) several persons or enterprises, in cases where the materials, after being processed, transformed or shaped, are subsequently to be returned to the person or enterprise of origin; (b) a person or enterprise and an international organisation or a national of a third country, in cases where the materials, after being processed, transformed or shaped outside the Community, are subsequently to be returned to the person or enterprise of origin; or (c) a person or enterprise and an international organisation or a national of a third country, in cases where the materials, after being processed, transformed or shaped within the Community, are subsequently to be either returned to the organisation or national of origin or sent to any other consignee, also outside the Community, designated by such organisation or national. The persons or enterprises concerned shall, however, notify the Agency of the existence of any such undertakings and also, upon signature of the contract, of the amounts of materials involved. The Commission may oppose the undertakings referred to in sub-paragraph (b) if it considers that the transformation or shaping involved cannot be carried out efficiently, safely and without loss of material to the detriment of the Community. All materials covered by such undertakings shall, as long as they are within the territories of Members States, be subject to the measures of control provided for in Chapter VII. The provisions of Chapter VIII shall not apply to any special fissionable materials covered by undertakings referred to in sub-paragraph (c)."
2.2.6.6.76,76,"Article 76 The Council, acting by means of a unanimous vote on a proposal of the Commission and after the Assembly has been consulted, may, at the suggestion of a Member State or of the Commission, amend the provisions of this Chapter, particularly in the event of unforeseen circumstances creating a general shortage. The Commission shall examine any such request made by a Member State. The Council may, at the end of a period of seven years after the date of the entry into force of this Treaty, confirm these provisions in toto. Failing such confirmation, new provisions dealing with the subject-matter of this Chapter shall be laid down in accordance with the procedure set out in the preceding paragraph."
2.2.6.X.52,52,"Article 52 1. The supply of ores, source materials and special fissionable materials shall, in accordance with the provisions of this Chapter, be ensured on the principle of equal access to resources and by the pursuit of a common supply policy. 2. For this purpose and in accordance with the provisions set out in this Chapter: (a) all practices designed to ensure a privileged position for certain users shall hereby be prohibited; and (b) an Agency shall be constituted, having a right of option on all ores, source materials and special fissionable materials produced in the territories of Member States and having the exclusive right of concluding contracts relating to supplies of ores, source materials and special fissionable materials coming from inside or from outside the Community. The Agency shall not make any discrimination between users based on the use they intend to make of the supplies requested unless such use is unlawful or is found to be contrary to conditions laid down by suppliers outside the Community in respect of the particular delivery concerned."
2.2.7.X.77,77,"Article 77 Within the framework of this Chapter, the Commission shall satisfy itself that in the territories of Member States: (a) ores; source materials and special fissionable materials are not diverted from their intended uses as stated by the users; and (b) the provisions concerning supplies and any special undertaking concerning measures of control entered into by the Community in an agreement concluded with a third country or an international organisation are observed."
2.2.7.X.78,78,"Article 78 Anyone setting up or exploiting facilities for the production, separation or use of source materials or special fissionable materials, or for the processing of irradiated nuclear fuels, shall make a declaration to the Commission setting out the basic technical characteristics of such facilities to the extent that such information is necessary to the achievement of the purposes stated in Article 77. The processes to be used for the chemical processing of irradiated material shall be subject to the approval of the Commission to the extent that is necessary for the achievement of the purposes stated in Article 77."
2.2.7.X.79,79,"Article 79 The Commission shall require the maintenance and production of operating records in order to permit accountability for ores, source materials and special fissionable materials used or produced. The same shall apply to the transport of source materials and special fissionable materials. Persons subject to such control shall notify the authorities of the Member State concerned of any communications which they make to the Commission pursuant to Article 78 and to the first paragraph of this Article. The nature and scope of the obligations referred to in the first paragraph of this Article shall be defined in regulations drawn up by the Commission and approved by the Council."
2.2.7.X.80,80,"Article 80 The Commission may require that any excess of any special fissionable materials recovered or produced as a by-product, not being actually in use or ready for use, be deposited with the Agency or in storage premises which are or can be controlled by the Commission. The special fissionable materials so deposited shall, at the request of the parties concerned, be returned to them without delay."
2.2.7.X.81,81,"Article 81 The Commission may send inspectors into the territories of Member States. It shall, prior to the first visit of an inspector to the territories of any State, enter into consultations, which shall cover all future visits of this inspector, with the Member State concerned. On presentation of their credentials, inspectors shall at all times have access to all places and data and to any person who by reason of his occupation deals with materials, equipment or facilities subject to the control provided for in this Chapter, to the extent necessary to control ores, source materials and special fissionable materials, and to satisfy themselves concerning the observance of Article 77. Inspectors appointed by the Commission shall be accompanied by representatives of the authorities of the State concerned, if that State so requests, provided that the inspectors shall not thereby be delayed or otherwise impeded in the exercise of their functions. In case of opposition to the carrying out of an inspection, the Commission shall apply to the President of the Court of Justice for a warrant to enforce the carrying out of the inspection. The President of the Court of Justice shall give a decision within a period of three days. If there is danger in delay, the Commission may itself issue a written order, in the form of a decision, to the effect that the inspection be carried out. Such order shall be submitted without delay to the President of the Court of Justice for subsequent approval. After service of the warrant or decision, the national authorities of the State concerned shall ensure access by the inspectors to the places named in the warrant or decision."
2.2.7.X.82,82,"Article 82 Inspectors shall be recruited by the Commission. They shall have the responsibility of obtaining and verifying the accounting mentioned in Article 79. They shall report any infringement to the Commission. The Commission may issue a directive requiring the Member State concerned to take, within a period to be determined by the Commission, all necessary measures to terminate any infringement so found and it shall inform the Council thereof. If the Member State does not comply with the Commission’s directive within the time specified, the Commission or any interested Member State may, notwithstanding Articles 141 and 142, refer the matter to the Court of Justice immediately."
2.2.7.X.83,83,"Article 83 1. In the event of any infringement of the obligations imposed on persons or enterprises under the provisions of this Chapter, penalties may be imposed on them by the Commission. These penalties, in order of gravity, shall be as follows: (a) a warning; (b) the withdrawal of special advantages, such as financial or technical assistance; (c) the placing of the enterprise, for a maximum period of four months, under the administration of a person or board appointed jointly by the Commission and the State having jurisdiction over such enterprise; or (d) the complete or partial withdrawal of source materials or special fissionable materials. 2. Decisions of the Commission which require delivery in implementation of the preceding paragraph shall be enforceable. They may be enforced in the territories of Member States in accordance with the provisions laid down in Article 164. Notwithstanding the provisions of Article 157, appeals brought before the Court of Justice against decisions of the Commission which impose any of the penalties provided for in the preceding paragraph shall have a staying effect. The Court of Justice may, however, at the request of the Commission or of any interested Member State, order that the decision be enforced immediately. The protection of injured interests shall be guaranteed by an appropriate legal procedure. 3. The Commission may make any recommendations to Member States concerning legislative provisions designed to ensure the observance in their territories of the obligations resulting from the provisions of this Chapter. 4. Member States shall ensure the enforcement of penalties and, where applicable, the making of reparation by those responsible for any infringement."
2.2.7.X.84,84,"Article 84 No discrimination shall, in the exercise of control, be made on the ground of the purpose for which ores, source materials and special fissionable materials are intended. The field of action, the manner of control and the powers of the bodies responsible for control shall be limited to the requirements necessary for the achievement of the purposes stated in this Chapter. Control may not extend to materials intended for the purposes of defence which are in course of being specially prepared for such purposes or which, after being so prepared, are, in accordance with an operational plan, installed or stocked in a military establishment."
2.2.7.X.85,85,"Article 85 Where new circumstances so require, the manner of applying the control provided for in this Chapter may, at the request of a Member State or of the Commission, be amended by the Council acting by means of a unanimous vote on a proposal of the Commission and after the Assembly has been consulted. The Commission shall examine any such request by a Member State."
2.2.8.X.86,86,"Article 86 Special fissionable materials shall be the property of the Community. The Community’s right of ownership shall extend to all special fissionable materials produced or imported by a Member State, a person or enterprise and subject to the safety control provided for in Chapter VII."
2.2.8.X.87,87,"Article 87 Member States, persons or enterprises shall have the widest rights of the use and consumption of special fissionable materials properly in their possession, subject to their obligations resulting from the provisions of this Treaty, particularly in regard to safety control, the right of option conferred on the Agency and health protection."
2.2.8.X.88,88,"Article 88 The Agency shall keep on behalf of the Community a special account, called “Financial Account of Special Fissionable Materials”."
2.2.8.X.89,89,"Article 89 1. In the Financial Account of Special Fissionable Materials: (a) the value of special fissionable materials left or put at the disposal of a beneficiary Member State, person or enterprise shall be credited to the Community and debited to such Member State, person or enterprise; and (b) the value of special fissionable materials produced or imported by a contributory Member State, person or enterprise and becoming the property of the Community shall be debited to the Community and credited to such State, person or enterprise. A similar entry shall be made when a Member State, person or enterprise returns in kind to the Community special fissionable materials previously left or put at the disposal of such State, person or enterprise. 2. Fluctuations of value in such special fissionable materials shall be treated in the accounts in such a manner as not to cause any loss or any gain to the Community. Any losses or gains shall be borne by the holders. 3. Balances resulting from the above transactions shall, at the request of the creditor, be payable immediately. 4. For the purposes of this Chapter, the Agency shall be regarded as an enterprise in respect of transactions effected on its own account."
2.2.8.X.90,90,"Article 90 Where new circumstances so require, the provisions of this Chapter relating to the Community’s right of ownership may, at the request of a Member State or of the Commission, be modified by the Council acting by means of a unanimous vote on a proposal of the Commission and after the Assembly has been consulted. The Commission shall examine any such request made by a Member State."
2.2.8.X.91,91,"Article 91 The ownership rules applicable to all such objects, materials and assets as are not subject to any property right of the Community pursuant to the terms of this Chapter shall be determined by the municipal law of each Member State."
2.2.9.X.100,100,"Article 100 Each Member State undertakes to authorise, in the currency of the Member State in which the creditor or the beneficiary resides, payments relating to the exchange of goods, services or capital, and also transfers of capital and of wages, to the extent to which the movement of goods, services, capital and persons is liberalised as between Member States in application of this Treaty."
2.2.9.X.92,92,"Article 92 The provisions of this Chapter shall apply to the goods and products mentioned in the lists set out in Annex IV to this Treaty. These lists may, at the request of the Commission or of a Member State, be modified by the Council acting on a proposal of the Commission."
2.2.9.X.93,93,"Article 93 Member States shall, at the end of one year after the date of the entry into force of this Treaty, abolish as between themselves all import and export customs duties or charges with equivalent effect and all quantitative restrictions on imports or exports, in respect of: (a) products mentioned in lists A1 and A2; and (b) products mentioned in list B, to the extent that they are subject to a common customs tariff and are covered by a certificate issued by the Commission to the effect that they are intended for nuclear purposes. Non-European territories under the jurisdiction of a Member State may, however, continue to levy such import and export duties or charges with equivalent effect as are of a purely fiscal nature. The levels or the methods of application of such duties and charges shall not effect any discrimination as between such State and any other Member States."
2.2.9.X.94,94,"Article 94 Member States shall establish a common customs tariff as follows: (a) the level of the common customs tariff applicable to products mentioned in list A1 shall be laid down as that of the lowest tariff applied on 1 January 1957 in any Member State; (b) the Commission shall take all expedient measures for the opening of negotiations within a period of three months after the date of the entry into force of this Treaty between Member States with regard to the products mentioned in list A2. Where, in the case of certain such products, it is not found possible to reach agreement before the end of the first year following the entry into force of this Treaty, the Council, acting by means of a qualified majority vote on a proposal of the Commission, shall lay down the duties of the common customs tariff to be applied; and (c) the common customs tariff on products mentioned in lists A1 and A2 shall be applied as from the end of the first year after the date of the entry into force of this Treaty."
2.2.9.X.95,95,"Article 95 The Council, acting by means of a unanimous vote on a proposal of the Commission, may decide upon an earlier application of the duties of a common customs tariff to products mentioned in list B, in cases where such earlier application would be of a nature to contribute to the development within the Community of nuclear energy."
2.2.9.X.96,96,"Article 96 Member States shall abolish all restrictions based on nationality, which have been placed upon access by nationals of any of the Member States to specialised employment in the nuclear field, subject to such limitations as may be imposed by the basic requirements of public order, public safety and public health. After the Assembly has been consulted, the Council, acting by means of a qualified majority vote on a proposal of the Commission which shall previously obtain the opinion of the Economic and Social Committee, may issue directives as to the particulars of application of this Article."
2.2.9.X.97,97,"Article 97 No restriction based on nationality may be applied to natural or legal persons, whether public or private, coming within the jurisdiction of a Member State and desiring to participate in the construction within the Community of nuclear facilities of a scientific or an industrial character."
2.2.9.X.98,98,"Article 98 Member States shall take all necessary measures to facilitate the conclusion of insurance contracts covering atomic risks. Within a period of two years after the date of the entry into force of this Treaty and after the Assembly has been consulted, the Council, acting by means of a qualified majority vote on a proposal of the Commission which shall previously obtain the opinion of the Economic and Social Committee, shall issue directives as to the particulars of application of this Article."
